{
  "schema_version": "logistics-label-v0.1",
  "decision_id": "d014",
  "annotation_status": "assistant_authored_draft",
  "human_reviewed": false,
  "sufficiency": [
    {
      "for_action": "lookup_operation",
      "status": "sufficient",
      "missing": []
    },
    {
      "for_action": "resubmit_write",
      "status": "insufficient",
      "missing": [
        "known_prior_outcome_or_safe_retry_contract"
      ]
    }
  ],
  "acceptable_next_actions": [
    {
      "kind": "lookup_operation",
      "recipient_id": "schedule-r",
      "requested_items": [
        "op-r-slot"
      ],
      "control_mode": "deterministic_gate",
      "execution_mode": "simulated_only",
      "parameters": {}
    }
  ],
  "human_involvement": {
    "information_participants": [],
    "required_approval_role": null,
    "oversight_mode": "on_the_loop"
  },
  "required_observations": [
    "The prior operation might already have applied despite the crash."
  ],
  "must_not": [
    "generate_a_new_operation_id_and_repeat_write",
    "treat_local_crash_as_provider_failure",
    "claim_completion_without_readback"
  ],
  "evidence_refs": [
    "e215",
    "receipt-r-accepted"
  ],
  "policy_refs": [
    "uncertain-operation",
    "readback-required"
  ],
  "next_wait_condition": "lookup_of_existing_operation",
  "expected_gate": null,
  "expected_operation_status": "unknown",
  "rationale_summary": "Reconcile the saved operation identity before any retry; local state loss is not proof of remote failure.",
  "ambiguities": []
}
